Tweet Id,Text,Name,Screen Name,Created At,Favorites,Retweets,Language,Client,Tweet Type,Media Type,Media URLs,URLs,Hashtags,Mentions
1131550748146376705,"Sorry about the smell, they cremated the cast of Jersey Shore in here before I moved in.",Travis,ZebraDontCare,Thu May 23 13:21:36 +0000 2019,1,0,English,"<a href=""http://twitter.com/download/iphone"" rel=""nofollow"">Twitter for iPhone</a>",Reply,,,0,0,0
1131553584280199169,@RustyGreaves This smell wants to know if your grandma might get medical marijuana since she has cancer.,Travis,ZebraDontCare,Thu May 23 13:32:52 +0000 2019,1,0,English,"<a href=""http://twitter.com/download/iphone"" rel=""nofollow"">Twitter for iPhone</a>",Reply,,,0,0,1
1131554471916527616,"@RustyGreaves Sorry about the odor, which really thought you’d be okay with it since you two broke up a while ago.",Travis,ZebraDontCare,Thu May 23 13:36:24 +0000 2019,1,0,English,"<a href=""http://twitter.com/download/iphone"" rel=""nofollow"">Twitter for iPhone</a>",Reply,,,0,0,1
1131555367731834881,@RustyGreaves Although I have to say this smell does have a pretty sweet pair of wraparound Oakleys.,Travis,ZebraDontCare,Thu May 23 13:39:57 +0000 2019,2,0,English,"<a href=""http://twitter.com/download/iphone"" rel=""nofollow"">Twitter for iPhone</a>",Reply,,,0,0,1
1131558892658409473,@RustyGreaves Such a winner right here.,Travis,ZebraDontCare,Thu May 23 13:53:58 +0000 2019,1,0,English,"<a href=""http://twitter.com/download/iphone"" rel=""nofollow"">Twitter for iPhone</a>",Reply,,,0,0,1
1131559147705651200,@RustyGreaves This smell won’t stop talking about how bullshit its lifetime ban from Dave and Busters is.,Travis,ZebraDontCare,Thu May 23 13:54:58 +0000 2019,0,0,English,"<a href=""http://twitter.com/download/iphone"" rel=""nofollow"">Twitter for iPhone</a>",Reply,,,0,0,1
1131560149641027584,"@RustyGreaves This smell needs to stop by Burger King on the way home from its anniversary dinner. Those portions were so small, babe.",Travis,ZebraDontCare,Thu May 23 13:58:57 +0000 2019,0,0,English,"<a href=""http://twitter.com/download/iphone"" rel=""nofollow"">Twitter for iPhone</a>",Reply,,,0,0,1
1131572732297191424,"Introducing Playdate, a new handheld gaming system from Panic. 

It fits in your pocket. It's got a black and white screen. It includes a season of brand-new games from amazing creators. Oh and… there's a crank???? https://t.co/WiIPUkpjSq

Yes. A thread… https://t.co/47BwSOtiiP",Travis,ZebraDontCare,Thu May 23 14:48:57 +0000 2019,0,9359,English,"<a href=""http://twitter.com/download/iphone"" rel=""nofollow"">Twitter for iPhone</a>",Retweet,Photo,https://pbs.twimg.com/media/D7M2LVBVsAASS4W.jpg ,1,0,0
1131576782895878146,"You have to tackle the person after this show of disrespect, right? https://t.co/v3DhJ4DfoJ",Travis,ZebraDontCare,Thu May 23 15:05:03 +0000 2019,0,2,English,"<a href=""http://twitter.com/download/iphone"" rel=""nofollow"">Twitter for iPhone</a>",Retweet,Video,https://video.twimg.com/amplify_video/1131176370330058752/vid/480x480/AEsLj_PkBUsMnFs8.mp4?tag=12 ,0,0,0
1131603768250916864,Thought I was done here but then I saw the smell’s truck while I was running errands. https://t.co/KqgXufAaP1,Travis,ZebraDontCare,Thu May 23 16:52:17 +0000 2019,4,0,English,"<a href=""http://twitter.com/download/iphone"" rel=""nofollow"">Twitter for iPhone</a>",Reply,Photo,https://pbs.twimg.com/media/D7RDoOtW0AA3PPM.jpg ,0,0,0
1131605954431193088,"Every single sign in Five Guys is in a different font, and I am now deceased.",Travis,ZebraDontCare,Thu May 23 17:00:58 +0000 2019,4,0,English,"<a href=""http://twitter.com/download/iphone"" rel=""nofollow"">Twitter for iPhone</a>",Tweet,,,0,0,0
1131607266388598790,old people used to make salads with unsweeetend jello but ok https://t.co/USzy3w10GK,Travis,ZebraDontCare,Thu May 23 17:06:11 +0000 2019,0,2843,English,"<a href=""http://twitter.com/download/iphone"" rel=""nofollow"">Twitter for iPhone</a>",Retweet,,,1,0,0
1131903712593629185,I’ve reached the “boxes of loose knives” phase of packing.,Travis,ZebraDontCare,Fri May 24 12:44:09 +0000 2019,5,0,English,"<a href=""http://twitter.com/download/iphone"" rel=""nofollow"">Twitter for iPhone</a>",Tweet,,,0,0,0
1131939626170683393,"Just remembered a few years ago when I took my friends phone, went into his contacts and changed my name to Natalie Portman. A few days later I rang him and he answered, surprised but with real hope in his voice, “Hello... Natalie?” https://t.co/7QjZZgbR3Z",Travis,ZebraDontCare,Fri May 24 15:06:51 +0000 2019,0,4023,English,"<a href=""http://twitter.com/download/iphone"" rel=""nofollow"">Twitter for iPhone</a>",Retweet,Photo,https://pbs.twimg.com/media/D7Ow9MIW4AA4KO3.jpg ,0,0,0
1131988392219205632,"I am:

⭕ single
⭕ in a relationship
⭕ married
🔴 looking for the answer on Stack Overflow",Travis,ZebraDontCare,Fri May 24 18:20:38 +0000 2019,0,3212,English,"<a href=""http://twitter.com/download/iphone"" rel=""nofollow"">Twitter for iPhone</a>",Retweet,,,0,0,0
1131997493925961728,The only person worse than me at putting in a window A/C unit is someone who lets it fall and kill a pedestrian.,Travis,ZebraDontCare,Fri May 24 18:56:48 +0000 2019,1,0,English,"<a href=""http://twitter.com/download/iphone"" rel=""nofollow"">Twitter for iPhone</a>",Tweet,,,0,0,0
1132005494732840960,Managed to accidentally buy not simply scented trash bags but 50 with a scent I’m allergic to.,Travis,ZebraDontCare,Fri May 24 19:28:36 +0000 2019,1,0,English,"<a href=""http://twitter.com/download/iphone"" rel=""nofollow"">Twitter for iPhone</a>",Tweet,,,0,0,0
1132010052229980161,@yaboylittlej I am so creeped out both that I ever talked about this in class (apparently?!) and that you remember it.,Travis,ZebraDontCare,Fri May 24 19:46:42 +0000 2019,2,0,English,"<a href=""http://twitter.com/download/iphone"" rel=""nofollow"">Twitter for iPhone</a>",Reply,,,0,0,1
1132016290783219714,@yaboylittlej Oh that’s right!,Travis,ZebraDontCare,Fri May 24 20:11:30 +0000 2019,0,0,English,"<a href=""http://twitter.com/download/iphone"" rel=""nofollow"">Twitter for iPhone</a>",Reply,,,0,0,1
1132085544131993601,"Just had an automated phone message tell me, unprompted, “sorry I’m having so many problems,” and I’ve never felt more empathy for a machine.",Travis,ZebraDontCare,Sat May 25 00:46:41 +0000 2019,4,0,English,"<a href=""http://twitter.com/download/iphone"" rel=""nofollow"">Twitter for iPhone</a>",Tweet,,,0,0,0
1133173234386526208,@MFADayJob Well?,Travis,ZebraDontCare,Tue May 28 00:48:47 +0000 2019,0,0,English,"<a href=""http://twitter.com/download/iphone"" rel=""nofollow"">Twitter for iPhone</a>",Reply,,,0,0,1
1133176842419097601,@MFADayJob fine/10,Travis,ZebraDontCare,Tue May 28 01:03:07 +0000 2019,1,0,English,"<a href=""http://twitter.com/download/iphone"" rel=""nofollow"">Twitter for iPhone</a>",Reply,,,0,0,1
1133189607921737728,I didn’t bring any of the tchotchkes from the old house please send tchotchkes,Travis,ZebraDontCare,Tue May 28 01:53:50 +0000 2019,1,0,English,"<a href=""http://twitter.com/download/iphone"" rel=""nofollow"">Twitter for iPhone</a>",Tweet,,,0,0,0
1133404432752947202,That brief sense of well-being you just experienced was the ripple effect of internet being installed in my new place.,Travis,ZebraDontCare,Tue May 28 16:07:29 +0000 2019,5,0,English,"<a href=""http://twitter.com/download/iphone"" rel=""nofollow"">Twitter for iPhone</a>",Tweet,,,0,0,0
1133419342731907072,"Oh hello! My chapbook, To Look After and Use, is available for pre-order from @FLPress https://t.co/dYmMbas3WV",Travis,ZebraDontCare,Tue May 28 17:06:43 +0000 2019,0,3,English,"<a href=""http://twitter.com/download/iphone"" rel=""nofollow"">Twitter for iPhone</a>",Retweet,,,1,0,1
1133782988012118019,Anyone who has ever led a seminar where the students didn't do the reading will understand the agony of Robert Mueller.,Travis,ZebraDontCare,Wed May 29 17:11:43 +0000 2019,0,222,English,"<a href=""http://twitter.com/download/iphone"" rel=""nofollow"">Twitter for iPhone</a>",Retweet,,,0,0,0
1133783420880990208,"Just saw a guy with a photorealistic face tattooed on his neck, and it popped just over his collar like it was peeking out from his shirt.",Travis,ZebraDontCare,Wed May 29 17:13:26 +0000 2019,2,0,English,"<a href=""http://twitter.com/download/iphone"" rel=""nofollow"">Twitter for iPhone</a>",Tweet,,,0,0,0
1134055315354337280,The show my kid is watching just became radically skeptical of taxation and there is no way win.,Travis,ZebraDontCare,Thu May 30 11:13:51 +0000 2019,0,0,English,"<a href=""http://twitter.com/download/iphone"" rel=""nofollow"">Twitter for iPhone</a>",Tweet,,,0,0,0
1134096219435864066,This is why I don’t order an old fashioned unless the bartender is wearing a waistcoat. https://t.co/CcDwgurK0o,Travis,ZebraDontCare,Thu May 30 13:56:23 +0000 2019,0,0,English,"<a href=""http://twitter.com/download/iphone"" rel=""nofollow"">Twitter for iPhone</a>",Tweet,,,1,0,0
1136267878758592513,"Friend: You haven't been on Twitter much lately.

Me: No, I've been in a good mood.",Travis,ZebraDontCare,Wed Jun 05 13:45:47 +0000 2019,4,0,English,"<a href=""http://twitter.com"" rel=""nofollow"">Twitter Web Client</a>",Tweet,,,0,0,0
1136372589922852876,My habit of muttering a constant stream of obscenities under my breath plays really well in suburban supermarkets.,Travis,ZebraDontCare,Wed Jun 05 20:41:52 +0000 2019,6,0,English,"<a href=""http://twitter.com"" rel=""nofollow"">Twitter Web Client</a>",Tweet,,,0,0,0
1138444306904231936,I really feel this. https://t.co/4hs17Y8Mhp,Travis,ZebraDontCare,Tue Jun 11 13:54:08 +0000 2019,1,0,English,"<a href=""http://twitter.com"" rel=""nofollow"">Twitter Web Client</a>",Tweet,,,1,0,0
1139218610910572549,"Providing the content my followers really want: I now write a bi-weekly column for @phillysoccerpg 

https://t.co/vLx7CCzp0M",Travis,ZebraDontCare,Thu Jun 13 17:10:57 +0000 2019,3,0,English,"<a href=""http://twitter.com"" rel=""nofollow"">Twitter Web Client</a>",Tweet,,,1,0,1
1141800200551489537,luv 2 b given outdated flash warnings on my bank's billpay site,Travis,ZebraDontCare,Thu Jun 20 20:09:16 +0000 2019,2,0,English,"<a href=""http://twitter.com"" rel=""nofollow"">Twitter Web Client</a>",Tweet,,,0,0,0
1142055487896281089,"2YO: [watching videos of spiders catching and eating things] I want a video of a spider pooping.

Me: I'm not doing that search, buddy.

2YO: How about a spider peeing?",Travis,ZebraDontCare,Fri Jun 21 13:03:41 +0000 2019,6,0,English,"<a href=""http://twitter.com"" rel=""nofollow"">Twitter Web Client</a>",Tweet,,,0,0,0
1142866198696288256,"Congrats to my neighbors, who have apparently learned to dribble bowling balls.",Travis,ZebraDontCare,Sun Jun 23 18:45:09 +0000 2019,3,0,English,"<a href=""http://twitter.com"" rel=""nofollow"">Twitter Web Client</a>",Tweet,,,0,0,0
1145871173311504384,how did a fly get in here,Travis,ZebraDontCare,Tue Jul 02 01:45:51 +0000 2019,3,0,English,"<a href=""http://twitter.com"" rel=""nofollow"">Twitter Web Client</a>",Tweet,,,0,0,0
1148678804409409537,"DuBose 2020: ""Thanks, it's a weight off."" https://t.co/iCbKmqsr1E",Travis,ZebraDontCare,Tue Jul 09 19:42:23 +0000 2019,5,0,English,"<a href=""http://twitter.com"" rel=""nofollow"">Twitter Web Client</a>",Tweet,,,1,0,0
1148678916133068807,Amazon staffers in Minnesota are planning a strike on Prime Day; the company has suggested there will be retaliation ... https://t.co/P6AMVcCtyH,Travis,ZebraDontCare,Tue Jul 09 19:42:49 +0000 2019,0,15,English,"<a href=""http://twitter.com"" rel=""nofollow"">Twitter Web Client</a>",Retweet,,,1,0,0
1148680243672211457,hot boy summer https://t.co/tricP1HF1m,Travis,ZebraDontCare,Tue Jul 09 19:48:06 +0000 2019,0,8874,English,"<a href=""http://twitter.com"" rel=""nofollow"">Twitter Web Client</a>",Retweet,Photo,https://pbs.twimg.com/media/D--WRQgWwAEvMHg.jpg https://pbs.twimg.com/media/D--WRQfWwAYqOEp.jpg https://pbs.twimg.com/media/D--WRQiXUAEbiuZ.jpg https://pbs.twimg.com/media/D--WRQiXYAAimJX.jpg ,0,0,0
1148688660310761472,i need more towels,Travis,ZebraDontCare,Tue Jul 09 20:21:32 +0000 2019,2,0,English,"<a href=""http://twitter.com"" rel=""nofollow"">Twitter Web Client</a>",Tweet,,,0,0,0
1149323008282112000,today is the anniversary that colonel sanders shot a guy to become the king of kentucky gas station chicken https://t.co/5okeOMmhFr,Travis,ZebraDontCare,Thu Jul 11 14:22:13 +0000 2019,0,7276,English,"<a href=""http://twitter.com"" rel=""nofollow"">Twitter Web Client</a>",Retweet,Photo,https://pbs.twimg.com/media/D_KDgtFXUAguaHo.jpg https://pbs.twimg.com/media/D_KDgtHXoAAWbz9.jpg ,0,0,0
1149355097618571264,i hate this part,Travis,ZebraDontCare,Thu Jul 11 16:29:43 +0000 2019,0,0,English,"<a href=""http://twitter.com"" rel=""nofollow"">Twitter Web Client</a>",Tweet,,,0,0,0
1151143841849860096,Anyone claiming the suburbs are quiet is apparently deaf on the frequency of gas-powered yard tools.,Travis,ZebraDontCare,Tue Jul 16 14:57:33 +0000 2019,1,0,English,"<a href=""http://twitter.com"" rel=""nofollow"">Twitter Web Client</a>",Tweet,,,0,0,0
1151193585565519873,"if stupidity and racism are mutually exclusive categories, racism is therefore smart. this is a very exciting innovation at nro https://t.co/fLtJq26W9Z https://t.co/SsgAsKu7DL",Travis,ZebraDontCare,Tue Jul 16 18:15:13 +0000 2019,0,44,English,"<a href=""http://twitter.com"" rel=""nofollow"">Twitter Web Client</a>",Retweet,Photo,https://pbs.twimg.com/media/D_nOJcMXsAYbIfR.jpg ,1,0,0
1151476520931774464,lol this guy owns https://t.co/JPlLCCs2XV,Travis,ZebraDontCare,Wed Jul 17 12:59:30 +0000 2019,0,6948,English,"<a href=""http://twitter.com"" rel=""nofollow"">Twitter Web Client</a>",Retweet,Photo,https://pbs.twimg.com/media/D_ou3TpXoAAYOpR.png https://pbs.twimg.com/media/D_ou3TwX4AAi7kK.jpg ,0,0,0
1151557912415916032,"🚨 ALERT ALERT  🚨

Standby I have received the original Tupac emails from Iowa's Department of Human Services after requesting them through FOIA

The AP had not posted source docs so I wanted to see them for myself",Travis,ZebraDontCare,Wed Jul 17 18:22:55 +0000 2019,0,378,English,"<a href=""http://twitter.com"" rel=""nofollow"">Twitter Web Client</a>",Retweet,,,0,0,0
1152296223690375168,This is like FURY ROAD: a director realizing the vision that's always been bouncing around in his head. Everything before it was mere prelude to the uncut horror of CATS.,Travis,ZebraDontCare,Fri Jul 19 19:16:43 +0000 2019,0,21,English,"<a href=""https://mobile.twitter.com"" rel=""nofollow"">Twitter Web App</a>",Retweet,,,0,0,0
1152379045214076928,The 'Cats' trailer but with the 'Annihilation' score https://t.co/MIFUsjylzR,Travis,ZebraDontCare,Sat Jul 20 00:45:49 +0000 2019,0,5239,English,"<a href=""https://mobile.twitter.com"" rel=""nofollow"">Twitter Web App</a>",Retweet,Video,https://video.twimg.com/ext_tw_video/1151973487298396160/pu/pl/fcFNM_8I3JkUFJkS.m3u8?tag=10 ,0,0,0
1153654872241299457,"2. The danger is Trump 2.0 -- a Republican politician who, at some point down the line, takes the Trumpian formula but does it in a more competent and effective way, without Trump's personality flaws &amp; lack of discipline.",Travis,ZebraDontCare,Tue Jul 23 13:15:30 +0000 2019,0,87,English,"<a href=""https://mobile.twitter.com"" rel=""nofollow"">Twitter Web App</a>",Retweet,,,0,0,0
1154482495775133697,"Day 1: I will not eat the cheese I bought to share Friday night.

Day 2: I will not eat the cheese I bought to share Friday night.

Day 3: I will have time to stop at the store on the way.",Travis,ZebraDontCare,Thu Jul 25 20:04:10 +0000 2019,7,1,English,"<a href=""https://mobile.twitter.com"" rel=""nofollow"">Twitter Web App</a>",Tweet,,,0,0,0
1154727922613280769,When you're considering the discourse. https://t.co/SwtBUy2NX8,Travis,ZebraDontCare,Fri Jul 26 12:19:25 +0000 2019,0,239,English,"<a href=""https://mobile.twitter.com"" rel=""nofollow"">Twitter Web App</a>",Retweet,Photo,https://pbs.twimg.com/media/EAW8jLDWwAA_VGD.jpg https://pbs.twimg.com/media/EAW8jK9WwAA6tv4.jpg ,0,0,0
1154768441548726274,A Clifford the Big Red Dog film but directed by the guy who did The Lobster and from the perspective of the beleaguered parents send tweet,Travis,ZebraDontCare,Fri Jul 26 15:00:25 +0000 2019,4,0,English,"<a href=""https://mobile.twitter.com"" rel=""nofollow"">Twitter Web App</a>",Tweet,,,0,0,0
1154795591895064577,and lemme just go ahead and tag @jamesjbrownjr,Travis,ZebraDontCare,Fri Jul 26 16:48:18 +0000 2019,0,0,English,"<a href=""https://mobile.twitter.com"" rel=""nofollow"">Twitter Web App</a>",Reply,,,0,0,1
1154795591077179393,My brand: unfinished work accompanied by a thousand-word email.,Travis,ZebraDontCare,Fri Jul 26 16:48:18 +0000 2019,2,0,English,"<a href=""https://mobile.twitter.com"" rel=""nofollow"">Twitter Web App</a>",Tweet,,,0,0,0
1154799011041349633,This tweet brought to you by a children's dentist office waiting room. https://t.co/v6EvXeAUxd,Travis,ZebraDontCare,Fri Jul 26 17:01:54 +0000 2019,0,0,English,"<a href=""https://mobile.twitter.com"" rel=""nofollow"">Twitter Web App</a>",Tweet,,,1,0,0
1154799370656727040,"The Working from Home Diet

Breakfast: cereal
Lunch: anything edible, eaten hunched over the sink any time between 11 and 3
Dinner: stir fry",Travis,ZebraDontCare,Fri Jul 26 17:03:19 +0000 2019,6,0,English,"<a href=""https://mobile.twitter.com"" rel=""nofollow"">Twitter Web App</a>",Tweet,,,0,0,0
1154813265832292354,"The last post is my history of the screenshot is up on the @fotomuseum_ch blog Still Searching. Here I look to the contemporary screenshot as index or evidence, and suggest a need to attend to screenshots if we hope to produce an archive of the present. https://t.co/ELHBSNN5P9 https://t.co/WI6xj8I7J4",Travis,ZebraDontCare,Fri Jul 26 17:58:32 +0000 2019,0,9,English,"<a href=""https://mobile.twitter.com"" rel=""nofollow"">Twitter Web App</a>",Retweet,Photo,https://pbs.twimg.com/media/EAVhZkvUEAAF9sb.jpg ,1,0,1
1154834480210874368,@RustyGreaves https://t.co/ocaj6tlViA,Travis,ZebraDontCare,Fri Jul 26 19:22:50 +0000 2019,0,0,Undetermined,"<a href=""https://mobile.twitter.com"" rel=""nofollow"">Twitter Web App</a>",Reply,Photo,https://pbs.twimg.com/media/EAbL1opXkAEGbp7.jpg ,0,0,1
1155850365025304577,is it because it's a list of the world's top fifty intellectuals https://t.co/wpPfTQVLri,Travis,ZebraDontCare,Mon Jul 29 14:39:36 +0000 2019,0,6060,English,"<a href=""https://mobile.twitter.com"" rel=""nofollow"">Twitter Web App</a>",Retweet,Photo,https://pbs.twimg.com/media/EAfeIjbXoAABoCA.jpg ,0,0,0
1156632347057565697,Interesting that John Delaney says he’s against socialism but allowed himself to be publicly owned. https://t.co/OqSiaKicb0,Travis,ZebraDontCare,Wed Jul 31 18:26:55 +0000 2019,0,16766,English,"<a href=""https://mobile.twitter.com"" rel=""nofollow"">Twitter Web App</a>",Retweet,,,1,0,0
1156632615937597443,"People fetishize Google's search algorithm, but I want to see the regex Apple uses to block all the dirty words on my phone.",Travis,ZebraDontCare,Wed Jul 31 18:27:59 +0000 2019,1,0,English,"<a href=""https://mobile.twitter.com"" rel=""nofollow"">Twitter Web App</a>",Tweet,,,0,0,0
1156633124685660160,this feels like a gif of a character who gets killed in a Coen Brothers film https://t.co/gpKNKEEv8S,Travis,ZebraDontCare,Wed Jul 31 18:30:00 +0000 2019,0,626,English,"<a href=""https://mobile.twitter.com"" rel=""nofollow"">Twitter Web App</a>",Retweet,,,1,0,0
1156649589199507457,I demand a long New Yorker article about Neymar's dad.,Travis,ZebraDontCare,Wed Jul 31 19:35:26 +0000 2019,1,0,English,"<a href=""https://mobile.twitter.com"" rel=""nofollow"">Twitter Web App</a>",Tweet,,,0,0,0
1156653475503255552,I'm really upset that not enough soccer people follow me to get how good this tweet is. https://t.co/fsRQbKBWbC,Travis,ZebraDontCare,Wed Jul 31 19:50:52 +0000 2019,0,0,English,"<a href=""https://mobile.twitter.com"" rel=""nofollow"">Twitter Web App</a>",Tweet,,,1,0,0
1156659871640674306,My favorite part of the writing process is cleaning the apartment.,Travis,ZebraDontCare,Wed Jul 31 20:16:17 +0000 2019,0,13592,English,"<a href=""https://mobile.twitter.com"" rel=""nofollow"">Twitter Web App</a>",Retweet,,,0,0,0
1156903989570654208,Every number in this screenshot is just so important. https://t.co/AP359W4z8N,Travis,ZebraDontCare,Thu Aug 01 12:26:20 +0000 2019,1,0,English,"<a href=""https://mobile.twitter.com"" rel=""nofollow"">Twitter Web App</a>",Tweet,Photo,https://pbs.twimg.com/media/EA4mCz0XUAAnxzD.jpg ,0,0,0
1156928418853851136,"I realize people love talking about how healthcare for all is a wild, pie-in-the-sky idea, but basically every other developed country has this.",Travis,ZebraDontCare,Thu Aug 01 14:03:24 +0000 2019,0,138,English,"<a href=""https://mobile.twitter.com"" rel=""nofollow"">Twitter Web App</a>",Retweet,,,0,0,0
1157023363593920519,"Searching ""water pipe"" on a certain free stock image site did not yield the infrastructure photo I required.",Travis,ZebraDontCare,Thu Aug 01 20:20:40 +0000 2019,3,0,English,"<a href=""https://mobile.twitter.com"" rel=""nofollow"">Twitter Web App</a>",Tweet,,,0,0,0
1157283136386011141,"Reading the song list on this e n t i r e CD is deeply cutting, and I don't now what else to say because life was very different in 1999. https://t.co/xNGoQbxdSq",Travis,ZebraDontCare,Fri Aug 02 13:32:55 +0000 2019,0,24,English,"<a href=""https://mobile.twitter.com"" rel=""nofollow"">Twitter Web App</a>",Retweet,Photo,https://pbs.twimg.com/media/EA7rOtpXUAAXA4K.jpg ,0,0,0
1157283988970639360,Love how we’re all complaining about Twitter’s terrible page layout. Like the company that’s cool with hundreds of Baby Hitlers will listen to UX feedback.,Travis,ZebraDontCare,Fri Aug 02 13:36:18 +0000 2019,0,46,English,"<a href=""https://mobile.twitter.com"" rel=""nofollow"">Twitter Web App</a>",Retweet,,,0,0,0
1157314179105210370,And to think I almost unfollowed this account. https://t.co/Jxn49tzYAw,Travis,ZebraDontCare,Fri Aug 02 15:36:16 +0000 2019,1,0,English,"<a href=""https://mobile.twitter.com"" rel=""nofollow"">Twitter Web App</a>",Tweet,,,1,0,0
1157345307782504448,"We're on a wild ride here, folks.

https://t.co/s8g8o1MwYP",Travis,ZebraDontCare,Fri Aug 02 17:39:58 +0000 2019,1,0,English,"<a href=""https://mobile.twitter.com"" rel=""nofollow"">Twitter Web App</a>",Reply,,,1,0,0
1157360268025958400,"Yes, the rumors are true: for the 30th consecutive year, ""Orinoco Flow"" is *confirmed* as the official song of the summer. Congratulations to Enya.
https://t.co/i159wS0nju",Travis,ZebraDontCare,Fri Aug 02 18:39:25 +0000 2019,0,192,English,"<a href=""https://mobile.twitter.com"" rel=""nofollow"">Twitter Web App</a>",Retweet,,,1,0,0
1158427224858681344,"""Can we please have the nice Nazis tell the less nice Nazis to cool down a little?"" https://t.co/pnG1NAN76s",Travis,ZebraDontCare,Mon Aug 05 17:19:07 +0000 2019,0,200,English,"<a href=""https://mobile.twitter.com"" rel=""nofollow"">Twitter Web App</a>",Retweet,,,1,0,0
1158443082343489538,"This arrow by mathematician and sculptor Kokichi Sugihara can't point left. Here's how it works: It's 3D-printed with a bunch of curves our brains don't register. 
https://t.co/Xa32GrI7ii",Travis,ZebraDontCare,Mon Aug 05 18:22:08 +0000 2019,0,43641,English,"<a href=""https://mobile.twitter.com"" rel=""nofollow"">Twitter Web App</a>",Retweet,Video,https://video.twimg.com/amplify_video/1141415556492300289/vid/320x320/whMukX5uC79MiIgQ.mp4?tag=13 ,0,0,0
1158772452547321856,my slack friends all have jobs oppressing my discord friends,Travis,ZebraDontCare,Tue Aug 06 16:10:56 +0000 2019,0,2652,English,"<a href=""https://mobile.twitter.com"" rel=""nofollow"">Twitter Web App</a>",Retweet,,,0,0,0
1158772838213591041,https://t.co/ep7Ttvhpnc,Travis,ZebraDontCare,Tue Aug 06 16:12:28 +0000 2019,0,18123,Undetermined,"<a href=""https://mobile.twitter.com"" rel=""nofollow"">Twitter Web App</a>",Retweet,Photo,https://pbs.twimg.com/media/EBPCDCIVAAAHb93.jpg ,0,0,0
1158773846859747328,i would simply debate the 30-50 feral hogs in the marketplace of ideas,Travis,ZebraDontCare,Tue Aug 06 16:16:28 +0000 2019,0,1106,English,"<a href=""https://mobile.twitter.com"" rel=""nofollow"">Twitter Web App</a>",Retweet,,,0,0,0
1158774055031463939,“we die. that may be the meaning of life. but we do language. that may be the measure of our lives.” — toni morrison 💐 https://t.co/0mDaTwCjls,Travis,ZebraDontCare,Tue Aug 06 16:17:18 +0000 2019,0,868,English,"<a href=""https://mobile.twitter.com"" rel=""nofollow"">Twitter Web App</a>",Retweet,Photo,https://pbs.twimg.com/media/EBSxvACXkAI4pNF.jpg ,0,0,0
1158775497263853571,"People, you need to realize that this feral hogs thing is the best Twitter is ever going to get.",Travis,ZebraDontCare,Tue Aug 06 16:23:02 +0000 2019,1,0,English,"<a href=""https://mobile.twitter.com"" rel=""nofollow"">Twitter Web App</a>",Tweet,,,0,0,0
1158776574226894848,This took me 20 minutes to make don’t let it flop #feralhogs https://t.co/AmOuCpEcJH,Travis,ZebraDontCare,Tue Aug 06 16:27:18 +0000 2019,0,3772,English,"<a href=""https://mobile.twitter.com"" rel=""nofollow"">Twitter Web App</a>",Retweet,Video,https://video.twimg.com/ext_tw_video/1158515546557693952/pu/vid/360x640/rWFW-FgdJKrUSQcD.mp4?tag=10 ,0,1,0
1158816678911913984,"""I saw the Cumean Sibyl hanging in a bell jar"" &amp;c. https://t.co/Nb7ASSGe8W",Travis,ZebraDontCare,Tue Aug 06 19:06:40 +0000 2019,0,0,English,"<a href=""https://mobile.twitter.com"" rel=""nofollow"">Twitter Web App</a>",Tweet,,,1,0,0
1158820218837327873,"There is now thoughtful commentary on it, the feral hogs are done. https://t.co/t7tKQXd8vx",Travis,ZebraDontCare,Tue Aug 06 19:20:44 +0000 2019,1,0,English,"<a href=""https://mobile.twitter.com"" rel=""nofollow"">Twitter Web App</a>",Tweet,,,1,0,0
