Tweet Id,Text,Name,Screen Name,Created At,Favorites,Retweets,Language,Client,Tweet Type,Media Type,Media URLs,URLs,Hashtags,Mentions
968490807417278464,#BREAKING: Trump EPA to shut down office handling research on chemicals' effects on children's health https://t.co/H7gHwSJqws https://t.co/5R63mQxLbS,Travis,ZebraDontCare,Tue Feb 27 14:19:36 +0000 2018,0,8216,English,"<a href=""http://twitter.com"" rel=""nofollow"">Twitter Web Client</a>",Retweet,Photo,https://pbs.twimg.com/media/DXAaR4PXkAslSj9.jpg ,1,1,0
968542691687649282,"Me, when hearing about serious injustice: What a shame.

Me, when the microwave beeps again to remind me hot food is inside: [trashes the room in a fit of rage]",Travis,ZebraDontCare,Tue Feb 27 17:45:47 +0000 2018,0,0,English,"<a href=""http://twitter.com"" rel=""nofollow"">Twitter Web Client</a>",Tweet,,,0,0,0
968549682006888448,"Apparently, I care about the 2nd amendment as much as conservatives care about the 4th, 6th, 8th, 13th, 14th and 15th.",Travis,ZebraDontCare,Tue Feb 27 18:13:33 +0000 2018,2,0,English,"<a href=""http://twitter.com"" rel=""nofollow"">Twitter Web Client</a>",Tweet,,,0,0,0
968648694475251712,Probably needs them to store grain. https://t.co/itQRTarJEF,Travis,ZebraDontCare,Wed Feb 28 00:47:00 +0000 2018,0,0,English,"<a href=""http://twitter.com"" rel=""nofollow"">Twitter Web Client</a>",Tweet,,,1,0,0
968654336476762113,"In honor of Steven Seagal's new cryptocurrency Bitcoiin2Gen:
https://t.co/dZKlxywrnO",Travis,ZebraDontCare,Wed Feb 28 01:09:25 +0000 2018,0,0,English,"<a href=""http://twitter.com"" rel=""nofollow"">Twitter Web Client</a>",Tweet,,,1,0,0
968906295020605440,The Union now have a genuinely dangerous attack if they can make the pieces fit. https://t.co/rctZA6XZDU,Travis,ZebraDontCare,Wed Feb 28 17:50:36 +0000 2018,0,0,English,"<a href=""http://twitter.com"" rel=""nofollow"">Twitter Web Client</a>",Tweet,,,1,0,0
968906694897164289,"Can I get a hot take, @MattDoyle76? https://t.co/0QQodaXd4q",Travis,ZebraDontCare,Wed Feb 28 17:52:12 +0000 2018,0,0,English,"<a href=""http://twitter.com"" rel=""nofollow"">Twitter Web Client</a>",Tweet,,,1,0,1
968918912124506112,@nra my favorite teacher at Dalton high school just blockaded his door and proceeded to shoot. We had to run out The back of the school in the rain. Students were being trampled and screaming. I dare you to tell me arming teachers will make us safe.,Travis,ZebraDontCare,Wed Feb 28 18:40:44 +0000 2018,0,24945,English,"<a href=""http://twitter.com"" rel=""nofollow"">Twitter Web Client</a>",Retweet,,,0,0,1
968959883960815616,I have a new project: Sheldon County is a generative podcast about life in a simulated American county that inhabits your phone https://t.co/wQfp0k3hHC,Travis,ZebraDontCare,Wed Feb 28 21:23:33 +0000 2018,0,75,English,"<a href=""http://twitter.com"" rel=""nofollow"">Twitter Web Client</a>",Retweet,Photo,https://pbs.twimg.com/media/DXI8Pt7VAAAmgdX.jpg ,0,0,0
969282260863209473,"Just got ""uninvited"" from a TEDx conference in favor of a speaker who has ""easier access"" to the conference arena. The conference theme? Breaking barriers.",Travis,ZebraDontCare,Thu Mar 01 18:44:34 +0000 2018,0,9510,English,"<a href=""http://twitter.com"" rel=""nofollow"">Twitter Web Client</a>",Retweet,,,0,0,0
969370745750028288,I am sorry I feel this way but mascots participating in solemn moments of silence is one of the funniest things in the world to me https://t.co/fFsExos2RU,Travis,ZebraDontCare,Fri Mar 02 00:36:10 +0000 2018,0,3205,English,"<a href=""http://twitter.com"" rel=""nofollow"">Twitter Web Client</a>",Retweet,Photo,https://pbs.twimg.com/media/DXOfUR2WkAAHO0y.jpg https://pbs.twimg.com/media/DXOfVzyW0AA2A3Q.jpg https://pbs.twimg.com/media/DXOfXVkX4AI1qRb.jpg https://pbs.twimg.com/media/DXOf9CuX0AAqlTd.jpg ,0,0,0
969587023362347008,"Why did we have 12 million stories about Trump voters farting around in diners and like, 3, about underpaid largely female WV teachers leading one of the largest strikes in recent memory?

Because it involves three core groups people don’t like: Unions. Poor people. Women. https://t.co/wtroHLA3oe",Travis,ZebraDontCare,Fri Mar 02 14:55:35 +0000 2018,0,19061,English,"<a href=""http://twitter.com"" rel=""nofollow"">Twitter Web Client</a>",Retweet,,,1,0,0
969639332913995776,"""The only thing that can stop a bad guy with a Wand of Fireball is a good guy with a Wand of Fireball,"" the wizard states while standing in a wooden hut, mere moments before the party burns to death.",Travis,ZebraDontCare,Fri Mar 02 18:23:26 +0000 2018,0,192,English,"<a href=""http://twitter.com"" rel=""nofollow"">Twitter Web Client</a>",Retweet,,,0,0,0
969646575646584833,"Alternative headline: ""Millenials Use Technology to Address Toxic Work Cultures"" https://t.co/5zNOSx9jnb",Travis,ZebraDontCare,Fri Mar 02 18:52:13 +0000 2018,0,0,English,"<a href=""http://twitter.com"" rel=""nofollow"">Twitter Web Client</a>",Tweet,,,1,0,0
969669249777225728,LOL https://t.co/ZMlHWr2s4x,Travis,ZebraDontCare,Fri Mar 02 20:22:19 +0000 2018,0,3,Undetermined,"<a href=""http://twitter.com"" rel=""nofollow"">Twitter Web Client</a>",Retweet,Photo,https://pbs.twimg.com/media/DXTzXBwX4AENdj3.jpg https://pbs.twimg.com/media/DXTzYOIXkAAiaLZ.jpg ,0,0,0
970138020254019584,"Scenes from a marriage:
""When are you going to explain why you brought a filthy coffee machine home?""
""Tomorrow.""",Travis,ZebraDontCare,Sun Mar 04 03:25:02 +0000 2018,1,0,English,"<a href=""http://twitter.com"" rel=""nofollow"">Twitter Web Client</a>",Tweet,,,0,0,0
970719900615536640,Nike Air Max Prosciutto https://t.co/N7UifBxCUW,Travis,ZebraDontCare,Mon Mar 05 17:57:14 +0000 2018,0,13607,Italian,"<a href=""http://twitter.com"" rel=""nofollow"">Twitter Web Client</a>",Retweet,,,1,0,0
970723693038104576,"Meanwhile, in transportation news about the Oscars: A @metrolosangeles rider spotted Ed Begley Jr. taking the Red Line to the Dolby Theater. (Via Tim de la Motte on Instagram, h/t @metrolosangeles) https://t.co/DHzZGMOnka",Travis,ZebraDontCare,Mon Mar 05 18:12:18 +0000 2018,0,729,English,"<a href=""http://twitter.com"" rel=""nofollow"">Twitter Web Client</a>",Retweet,Photo,https://pbs.twimg.com/media/DXft_kjV4AASnA4.jpg https://pbs.twimg.com/media/DXft_keVMAEo5pQ.jpg ,0,0,2
970759488771887105,Bless the editor who let Jane Mayer keep this entire paragraph in her piece on the Steele dossier https://t.co/gbgwCssExE https://t.co/ZGmYYzNcV3,Travis,ZebraDontCare,Mon Mar 05 20:34:32 +0000 2018,0,931,English,"<a href=""http://twitter.com"" rel=""nofollow"">Twitter Web Client</a>",Retweet,Photo,https://pbs.twimg.com/media/DXib_x9VMAExDDt.jpg ,1,0,0
970815262663602176,The existential bleakness that is the 1984 Dune colouring book... https://t.co/Zn9C7rMDtq,Travis,ZebraDontCare,Tue Mar 06 00:16:10 +0000 2018,0,1504,English,"<a href=""http://twitter.com"" rel=""nofollow"">Twitter Web Client</a>",Retweet,Photo,https://pbs.twimg.com/media/DXdcNQJX4AEk8MJ.jpg https://pbs.twimg.com/media/DXdcN26XkAAreHl.jpg https://pbs.twimg.com/media/DXdcOb-X0AAGO6Y.jpg https://pbs.twimg.com/media/DXdcPBNWsAoPkqg.jpg ,0,0,0
970820131331993606,cc: @RustyGreaves https://t.co/OfXxKeyb8r,Travis,ZebraDontCare,Tue Mar 06 00:35:30 +0000 2018,1,0,Undetermined,"<a href=""http://twitter.com"" rel=""nofollow"">Twitter Web Client</a>",Tweet,,,1,0,1
970820883374845953,this is the new logo. if you want to contact me you have to put the new logo in the email and send it to me. please get rid of the old logo https://t.co/wCLOnGiw2E,Travis,ZebraDontCare,Tue Mar 06 00:38:30 +0000 2018,0,907,English,"<a href=""http://twitter.com"" rel=""nofollow"">Twitter Web Client</a>",Retweet,Photo,https://pbs.twimg.com/media/DXkLnItVwAAJYq9.jpg ,0,0,0
970823409386049542,I've been doing this for years but I could not write a 4 panel comic as funny as this: https://t.co/p2mdCx7fzV,Travis,ZebraDontCare,Tue Mar 06 00:48:32 +0000 2018,0,654,English,"<a href=""http://twitter.com"" rel=""nofollow"">Twitter Web Client</a>",Retweet,Photo,https://pbs.twimg.com/media/DXkKFOSUMAIfyho.jpg ,0,0,0
971026147810201600,A flurry of commits today as the parsing system snaps into place all at once. https://t.co/UQZHA1WGox,Travis,ZebraDontCare,Tue Mar 06 14:14:09 +0000 2018,0,0,English,"<a href=""http://twitter.com"" rel=""nofollow"">Twitter Web Client</a>",Reply,Photo,https://pbs.twimg.com/media/DXnHDSJX0AIsJNo.jpg ,0,0,0
971027245740576768,"As I worked this morning, I had that epiphanic feeling of solving sudoku where you've reached the end and are just filling in numbers.

Within a week I'll have a working single-book parser, the biggest milestone for an alpha.",Travis,ZebraDontCare,Tue Mar 06 14:18:30 +0000 2018,0,1,English,"<a href=""http://twitter.com"" rel=""nofollow"">Twitter Web Client</a>",Reply,,,0,0,0
971027806384771072,"Once the initial parsing system is done, I'm going to move on to the output system rather than working taking multi-book input: the earlier I can get some output and start tweaking settings based on it, the better.",Travis,ZebraDontCare,Tue Mar 06 14:20:44 +0000 2018,0,0,English,"<a href=""http://twitter.com"" rel=""nofollow"">Twitter Web Client</a>",Reply,,,0,0,0
971027977906552833,"As I worked this morning, I had that epiphanic feeling of solving sudoku where you've reached the end and are just filling in numbers.

Within a week I'll have a working single-book parser, the biggest milestone for an alpha.",Travis,ZebraDontCare,Tue Mar 06 14:21:25 +0000 2018,0,1,English,"<a href=""http://twitter.com"" rel=""nofollow"">Twitter Web Client</a>",Retweet,,,0,0,0
971034564129968129,https://t.co/9UI8LAw2p4,Travis,ZebraDontCare,Tue Mar 06 14:47:35 +0000 2018,1,0,Undetermined,"<a href=""http://twitter.com"" rel=""nofollow"">Twitter Web Client</a>",Tweet,Photo,https://pbs.twimg.com/media/DXnOuFtWAAEMoET.jpg ,0,0,0
971038847663595521,R.I.P. https://t.co/TaWh7JIIXA,Travis,ZebraDontCare,Tue Mar 06 15:04:36 +0000 2018,0,589,Undetermined,"<a href=""http://twitter.com"" rel=""nofollow"">Twitter Web Client</a>",Retweet,Photo,https://pbs.twimg.com/media/DXi5lKHUQAAVRzL.jpg ,0,0,0
971117476892246017,https://t.co/ggH5vf0diY,Travis,ZebraDontCare,Tue Mar 06 20:17:03 +0000 2018,0,0,Undetermined,"<a href=""http://twitter.com"" rel=""nofollow"">Twitter Web Client</a>",Tweet,GIF,https://video.twimg.com/tweet_video/DXoaMKRXUAISWxm.mp4 ,0,0,0
971181371707285505,"in the year 2030 , ""You will be able to order food on the cell phone""",Travis,ZebraDontCare,Wed Mar 07 00:30:57 +0000 2018,0,2308,English,"<a href=""http://twitter.com"" rel=""nofollow"">Twitter Web Client</a>",Retweet,,,0,0,0
971206588102074369,OK there READY PLAYER ONE just stop it https://t.co/s1px8ESniC,Travis,ZebraDontCare,Wed Mar 07 02:11:09 +0000 2018,0,425,English,"<a href=""http://twitter.com"" rel=""nofollow"">Twitter Web Client</a>",Retweet,Photo,https://pbs.twimg.com/media/DXoy6t2XcAAgbbK.jpg ,0,0,0
971399032349253634,mortalkombatfatality.wav https://t.co/8XfLN6CPXT,Travis,ZebraDontCare,Wed Mar 07 14:55:51 +0000 2018,0,0,Polish,"<a href=""http://twitter.com"" rel=""nofollow"">Twitter Web Client</a>",Tweet,,,1,0,0
971399902822584320,"I've heard it said a million times not to worry about performance until performance becomes an issue. However, I'm looping through so many arrays so many times, it's hard not to get worried about using array.forEach since I know how poorly it performs.",Travis,ZebraDontCare,Wed Mar 07 14:59:19 +0000 2018,0,0,English,"<a href=""http://twitter.com"" rel=""nofollow"">Twitter Web Client</a>",Reply,,,0,0,0
971400165214040064,"But forEach is so much more readable, especially when you're nesting two or three loops deep as I sometimes am.",Travis,ZebraDontCare,Wed Mar 07 15:00:21 +0000 2018,0,0,English,"<a href=""http://twitter.com"" rel=""nofollow"">Twitter Web Client</a>",Reply,,,0,0,0
971401032856211456,"Some basic performance testing on nested loops. I ran each test an increasing number of times. Once you reach 100,000 cycles, for loops are literally performing 9 times better than forEach.

Some of the parser functions will be run much more than 100,000 times. https://t.co/j26AFz53X4",Travis,ZebraDontCare,Wed Mar 07 15:03:48 +0000 2018,0,0,English,"<a href=""http://twitter.com"" rel=""nofollow"">Twitter Web Client</a>",Reply,Photo,https://pbs.twimg.com/media/DXsbd-JW0AELLM7.jpg ,0,0,0
971401525384876033,"The working solution: try to stick to for loops as much as possible, allow myself forEach if the code starts becoming spaghetti.",Travis,ZebraDontCare,Wed Mar 07 15:05:46 +0000 2018,0,0,English,"<a href=""http://twitter.com"" rel=""nofollow"">Twitter Web Client</a>",Reply,,,0,0,0
971407417983602691,"I understand that the president is being sued by a porn star and that idiots continue to swan dive from his ship of idiots.

However: public educators just won a wildcat strike in West Virginia.

https://t.co/ycKB3UaaHi",Travis,ZebraDontCare,Wed Mar 07 15:29:10 +0000 2018,1,0,English,"<a href=""http://twitter.com"" rel=""nofollow"">Twitter Web Client</a>",Tweet,,,1,0,0
971419132108460032,"Just got word that I can finally share my rejected theme song from @readyplayerone. They went with Alan Silvestri's theme, but I still want to thank Steven Spielberg &amp; @WarnerBrosEnt for the wonderful opportunity. https://t.co/aK32ZOUA16",Travis,ZebraDontCare,Wed Mar 07 16:15:43 +0000 2018,0,22097,English,"<a href=""http://twitter.com"" rel=""nofollow"">Twitter Web Client</a>",Retweet,Video,https://video.twimg.com/ext_tw_video/971208583302950912/pu/vid/320x180/N1cV6D-tSSplakWX.mp4 ,0,0,2
971423939447619585,"This is a keystone libertarian framework within American political culture, that questions of race and questions economics are understood as completely different and unconnected things. https://t.co/qGSd61ro3a",Travis,ZebraDontCare,Wed Mar 07 16:34:50 +0000 2018,0,23,English,"<a href=""http://twitter.com"" rel=""nofollow"">Twitter Web Client</a>",Retweet,,,1,0,0
971771792619720704,I have a working parser. https://t.co/cAMJeSHOvK,Travis,ZebraDontCare,Thu Mar 08 15:37:04 +0000 2018,0,0,English,"<a href=""http://twitter.com"" rel=""nofollow"">Twitter Web Client</a>",Reply,Photo,https://pbs.twimg.com/media/DXxtOrOXUAADGWW.jpg ,0,0,0
971774970090213378,This is what a totally clean working directory looks like BECAUSE I HAVE A WORKING PARSER. https://t.co/vkt5lMbSYb,Travis,ZebraDontCare,Thu Mar 08 15:49:42 +0000 2018,0,0,English,"<a href=""http://twitter.com"" rel=""nofollow"">Twitter Web Client</a>",Reply,Photo,https://pbs.twimg.com/media/DXxwJ6kX0AEh-Ca.jpg https://pbs.twimg.com/media/DXxwLZyXcAAzyBI.jpg ,0,0,0
971776145673936898,I want to take the afternoon off. https://t.co/orKPN3ktC1,Travis,ZebraDontCare,Thu Mar 08 15:54:22 +0000 2018,0,0,English,"<a href=""http://twitter.com"" rel=""nofollow"">Twitter Web Client</a>",Reply,Photo,https://pbs.twimg.com/media/DXxxOY4W0AAU9tm.jpg ,0,0,0
971820478846439425,"WATCH: Florida state Rep. Elizabeth Porter dismisses Florida shooting survivors calls for increased gun control.

""Do we allow the children to tell us that we should pass a law that says no homework?""

https://t.co/Lrjygjriqh https://t.co/iYBpePcpYG",Travis,ZebraDontCare,Thu Mar 08 18:50:32 +0000 2018,0,4545,English,"<a href=""http://twitter.com"" rel=""nofollow"">Twitter Web Client</a>",Retweet,Video,https://video.twimg.com/ext_tw_video/971444988700590082/pu/vid/320x180/RlLkA_9-cOZKOSpc.mp4 ,1,0,0
972144498212995072,Petition https://t.co/usHjEw4xkL,Travis,ZebraDontCare,Fri Mar 09 16:18:04 +0000 2018,0,1506,French,"<a href=""http://twitter.com"" rel=""nofollow"">Twitter Web Client</a>",Retweet,Photo,https://pbs.twimg.com/media/DXx_dHQXUAAOPd7.jpg ,0,0,0
972151318591823872,Sometimes I’ll make fan art of this Achewood panel because I need to meditate on it. https://t.co/Qcj0VL5RMv,Travis,ZebraDontCare,Fri Mar 09 16:45:10 +0000 2018,0,411,English,"<a href=""http://twitter.com"" rel=""nofollow"">Twitter Web Client</a>",Retweet,Photo,https://pbs.twimg.com/media/DX04JblU0AgC1qy.jpg ,0,0,0
972267508811038720,https://t.co/tCFtmxhnQM,Travis,ZebraDontCare,Sat Mar 10 00:26:52 +0000 2018,0,0,Undetermined,"<a href=""http://twitter.com"" rel=""nofollow"">Twitter Web Client</a>",Tweet,GIF,https://video.twimg.com/tweet_video/DX4wIlHW0AAjOFr.mp4 ,0,0,0
972273161298378752,There Is No Campus Free Speech Crisis: An Unreasonably Long Thread,Travis,ZebraDontCare,Sat Mar 10 00:49:20 +0000 2018,0,2975,English,"<a href=""http://twitter.com"" rel=""nofollow"">Twitter Web Client</a>",Retweet,,,0,0,0
973589764367699968,"“I cannot begin my day with a confrontation, please. I’m delivering the dress today and I cannot take up space with confrontation. I simply do not have time for confrontation.” https://t.co/YrGvrXlhXv",Travis,ZebraDontCare,Tue Mar 13 16:01:02 +0000 2018,0,2088,English,"<a href=""http://twitter.com"" rel=""nofollow"">Twitter Web Client</a>",Retweet,Photo,https://pbs.twimg.com/media/DYDtyx8W4AEkXjy.jpg ,0,0,0
973632426978115584,"Just committed the first piece of the public API: torgo.parse. Thank you, spring break.",Travis,ZebraDontCare,Tue Mar 13 18:50:34 +0000 2018,0,0,English,"<a href=""http://twitter.com"" rel=""nofollow"">Twitter Web Client</a>",Reply,,,0,0,0
973646007081807873,"Looking at code I wrote a week ago and totally baffled by how it works.

This isn't stuff I cribbed from StackExchange, it's my own code, written in the recent past.",Travis,ZebraDontCare,Tue Mar 13 19:44:32 +0000 2018,0,0,English,"<a href=""http://twitter.com"" rel=""nofollow"">Twitter Web Client</a>",Reply,,,0,0,0
973704778730692609,i despise the toilet. id love nothing more than to kick it through the wall and shatter it into 100 shards of wet porcelain. But i need it,Travis,ZebraDontCare,Tue Mar 13 23:38:04 +0000 2018,0,7820,English,"<a href=""http://twitter.com"" rel=""nofollow"">Twitter Web Client</a>",Retweet,,,0,0,0
973977324172521476,Just committed the second piece of the API. That's 2 out of 3 I need for a working alpha.,Travis,ZebraDontCare,Wed Mar 14 17:41:04 +0000 2018,0,0,English,"<a href=""http://twitter.com"" rel=""nofollow"">Twitter Web Client</a>",Reply,,,0,0,0
974283867883483136,"Oh yeah: NaN is considered a number in JS.

Because of course a thing whose name is ""not a number"" should be considered a number.

OF COURSE.",Travis,ZebraDontCare,Thu Mar 15 13:59:10 +0000 2018,0,0,English,"<a href=""http://twitter.com"" rel=""nofollow"">Twitter Web Client</a>",Reply,,,0,0,0
974290165714882560,"Not calling this a working alpha, but the basic process is actually completing. https://t.co/cd1bT7Q92p",Travis,ZebraDontCare,Thu Mar 15 14:24:11 +0000 2018,0,0,English,"<a href=""http://twitter.com"" rel=""nofollow"">Twitter Web Client</a>",Reply,Photo,https://pbs.twimg.com/media/DYVfuj3X4AAHvF4.jpg ,0,0,0
974298824234717185,"And a bit of tweaking that leads to actual ""sentences.""

Interestingly, even this gibberish is miles ahead of the early experiments I made with just a ""MadLibs"" style movement from one work to another. https://t.co/hZ8RHsVvyf",Travis,ZebraDontCare,Thu Mar 15 14:58:35 +0000 2018,0,0,English,"<a href=""http://twitter.com"" rel=""nofollow"">Twitter Web Client</a>",Reply,Photo,https://pbs.twimg.com/media/DYVnGt-X4AEUIFt.jpg ,0,0,0
974368205564194816,"The basic technical pieces are working, but it feels like a hollow victory: it's slow as all hell.

So, while I'd like to get on with tweaking the conceptual pieces, I think I'm going to attempt a major refactor before the code becomes too unmanageable.",Travis,ZebraDontCare,Thu Mar 15 19:34:17 +0000 2018,0,0,English,"<a href=""http://twitter.com"" rel=""nofollow"">Twitter Web Client</a>",Reply,,,0,0,0
974633587009052673,Gina Haspel oversaw interrogation tactics so brutal that CIA personnel at one black site openly wept and requested transfers after torture sessions. Details here:  https://t.co/FwxPuSrGpt,Travis,ZebraDontCare,Fri Mar 16 13:08:49 +0000 2018,0,5849,English,"<a href=""http://twitter.com"" rel=""nofollow"">Twitter Web Client</a>",Retweet,,,1,0,0
974718523908993025,I have watched this eight times so far. https://t.co/ZTHI8tqaBE,Travis,ZebraDontCare,Fri Mar 16 18:46:20 +0000 2018,0,0,English,"<a href=""http://twitter.com"" rel=""nofollow"">Twitter Web Client</a>",Tweet,,,1,0,0
974797269194199041,she is an influencer on youtube https://t.co/0zP5aYtfIW,Travis,ZebraDontCare,Fri Mar 16 23:59:14 +0000 2018,0,91340,English,"<a href=""http://twitter.com"" rel=""nofollow"">Twitter Web Client</a>",Retweet,Photo,https://pbs.twimg.com/media/DYbMI2XVoAARcEt.jpg ,0,0,0
975412558298533888,"Around 401 BCE, the Greek writer Xenophon fought a war in Persia. After a defeat, he &amp; his men fled back to Greece across Mesopotamia.

As they were chased across the Tigris River, they came across an incredible sight: the walls of an enormous ruined city, crumbling into the sand https://t.co/aeSWK6bGjU",Travis,ZebraDontCare,Sun Mar 18 16:44:10 +0000 2018,0,1028,English,"<a href=""http://twitter.com"" rel=""nofollow"">Twitter Web Client</a>",Retweet,Photo,https://pbs.twimg.com/media/DYlQE0UWAAE7YLG.jpg ,0,0,0
975727145573126144,Going to get this framed for all my graduating students this semester. https://t.co/mcDt3L3m7b,Travis,ZebraDontCare,Mon Mar 19 13:34:14 +0000 2018,1,0,English,"<a href=""http://twitter.com"" rel=""nofollow"">Twitter Web Client</a>",Tweet,,,1,0,0
975756226498912257,@ChappellTracker Definitely didn't expect to come out of class to a squiggle-take.,Travis,ZebraDontCare,Mon Mar 19 15:29:47 +0000 2018,1,0,English,"<a href=""http://twitter.com"" rel=""nofollow"">Twitter Web Client</a>",Reply,,,0,0,1
975761103450853376,Satan in 'Red Hot Mamma' (1934) produced by Fleischer Studios https://t.co/h6FXNtAHOQ,Travis,ZebraDontCare,Mon Mar 19 15:49:10 +0000 2018,0,524,English,"<a href=""http://twitter.com"" rel=""nofollow"">Twitter Web Client</a>",Retweet,GIF,https://video.twimg.com/tweet_video/DYhaJa-VoAEsNM3.mp4 ,0,0,0
975783260562259968,I quit. https://t.co/mAptVWXlB3,Travis,ZebraDontCare,Mon Mar 19 17:17:13 +0000 2018,1,0,English,"<a href=""http://twitter.com"" rel=""nofollow"">Twitter Web Client</a>",Tweet,Photo,https://pbs.twimg.com/media/DYqtsCuXkAIK_8m.jpg ,0,0,0
975821272943939584,Relive the Golden Age of Tiger Electronics Handhelds Thanks to the Internet Archive https://t.co/mCmQWSB4Ib via @motherboard,Travis,ZebraDontCare,Mon Mar 19 19:48:16 +0000 2018,0,0,English,"<a href=""http://twitter.com"" rel=""nofollow"">Twitter Web Client</a>",Tweet,,,1,0,1
975899458696286208,Only a few years until the Invasion of Iraq is old enough to sign up to fight in Iraq.,Travis,ZebraDontCare,Tue Mar 20 00:58:56 +0000 2018,0,244,English,"<a href=""http://twitter.com"" rel=""nofollow"">Twitter Web Client</a>",Retweet,,,0,0,0
976103725558386689,"These snowstorms have to stop, I can't listen to any more Bon Iver.",Travis,ZebraDontCare,Tue Mar 20 14:30:37 +0000 2018,1,0,English,"<a href=""http://twitter.com"" rel=""nofollow"">Twitter Web Client</a>",Tweet,,,0,0,0
976620347851145216,"Me? No I don’t have kids, I don’t have the time what with my https://t.co/d5jH02vneQ",Travis,ZebraDontCare,Thu Mar 22 00:43:30 +0000 2018,0,3401,English,"<a href=""http://twitter.com"" rel=""nofollow"">Twitter Web Client</a>",Retweet,Photo,https://pbs.twimg.com/media/DYw1pI_U8AU3c4q.jpg ,0,0,0
976820695220019200,"Forgot my laptop charger at work ahead of two days working at home, and I'm just wondering how it could all go so wrong. How did I become such a person?",Travis,ZebraDontCare,Thu Mar 22 13:59:36 +0000 2018,2,0,English,"<a href=""http://twitter.com"" rel=""nofollow"">Twitter Web Client</a>",Tweet,,,0,0,0
976828008924315648,Business idea: a cleaning service staffed entirely by writers on deadline.,Travis,ZebraDontCare,Thu Mar 22 14:28:40 +0000 2018,0,5710,English,"<a href=""http://twitter.com"" rel=""nofollow"">Twitter Web Client</a>",Retweet,,,0,0,0
976830313098829824,"@mtrc I mean, in some sense, isn't that what coding is?",Travis,ZebraDontCare,Thu Mar 22 14:37:49 +0000 2018,1,0,English,"<a href=""http://twitter.com"" rel=""nofollow"">Twitter Web Client</a>",Reply,,,0,0,1
976837780218183682,"Ah yes, the three genders. https://t.co/YrPjUTt7fF",Travis,ZebraDontCare,Thu Mar 22 15:07:30 +0000 2018,2,0,English,"<a href=""http://twitter.com"" rel=""nofollow"">Twitter Web Client</a>",Tweet,Photo,https://pbs.twimg.com/media/DY5sxH8XkAEVx6v.jpg ,0,0,0
976903393942884352,This post has killed me. I am dead. I am now tweeting from the afterlife. 😂😂😂 https://t.co/udB7NEkrXC,Travis,ZebraDontCare,Thu Mar 22 19:28:13 +0000 2018,0,8567,English,"<a href=""http://twitter.com"" rel=""nofollow"">Twitter Web Client</a>",Retweet,Photo,https://pbs.twimg.com/media/DYxwzMCW0AEvRyg.jpg ,0,0,0
977181112991707137,"sorry i’m still thinking about when the priest at my dad’s wedding said, “what is love? no one knows. couples go to parties and when they leave we ask, ‘what does she see in him? what does he see in her?’ no one knows”",Travis,ZebraDontCare,Fri Mar 23 13:51:47 +0000 2018,0,396,English,"<a href=""http://twitter.com"" rel=""nofollow"">Twitter Web Client</a>",Retweet,,,0,0,0
977234533203480577,"Tech buzzwords explained:
AI—regression
Big data—data
Blockchain—database
Algorithm—automated decision-making
Cloud—Internet
Crypto—cryptocurrency
Dark web—Onion service
Data science—statistics done by nonstatisticians
Disruption—competition
Viral—popular
IoT—malware-ready device",Travis,ZebraDontCare,Fri Mar 23 17:24:03 +0000 2018,0,23410,English,"<a href=""http://twitter.com"" rel=""nofollow"">Twitter Web Client</a>",Retweet,,,0,0,0
977328199444021248,bonus: https://t.co/IYV3OHeCZL,Travis,ZebraDontCare,Fri Mar 23 23:36:15 +0000 2018,0,4,Turkish,"<a href=""http://twitter.com"" rel=""nofollow"">Twitter Web Client</a>",Retweet,Video,https://video.twimg.com/ext_tw_video/977325586031960069/pu/vid/240x180/QLKkcXB6C6XoV4o1.mp4 ,0,0,0
