Tweet Id,Text,Name,Screen Name,Created At,Favorites,Retweets,Language,Client,Tweet Type,Media Type,Media URLs,URLs,Hashtags,Mentions
1103750974219436032,🚨🚨🚨 I found a skirt at Goodwill with a REGEX CHEATSHEET 🚨🚨🚨 https://t.co/ajQBeVy2rB,Travis,ZebraDontCare,Thu Mar 07 20:15:13 +0000 2019,0,20,English,"<a href=""http://twitter.com"" rel=""nofollow"">Twitter Web Client</a>",Retweet,Photo,https://pbs.twimg.com/media/D07_KmMUYAE4tUa.jpg https://pbs.twimg.com/media/D07_LJcVsAE8c0C.jpg ,0,0,0
1103795678457856000,"2YO: My teachers have music CDs.

Me: Do they play music for you?

2YO: Yeah. They put them in the music hole.",Travis,ZebraDontCare,Thu Mar 07 23:12:51 +0000 2019,9,0,English,"<a href=""http://twitter.com/download/iphone"" rel=""nofollow"">Twitter for iPhone</a>",Tweet,,,0,0,0
1103827170860904449,"For context on Manafort’s 47 months in prison, my client yesterday was offered 36-72 months in prison for stealing $100 worth of quarters from a residential laundry room.",Travis,ZebraDontCare,Fri Mar 08 01:18:00 +0000 2019,0,60002,English,"<a href=""http://twitter.com/download/iphone"" rel=""nofollow"">Twitter for iPhone</a>",Retweet,,,0,0,0
1103827598398943232,"This is the right take. The scandal is that many, many other people, from less privileged backgrounds than Manafort, also deserve a mercy they don't get. https://t.co/MeBNGZNB49",Travis,ZebraDontCare,Fri Mar 08 01:19:42 +0000 2019,0,110,English,"<a href=""http://twitter.com/download/iphone"" rel=""nofollow"">Twitter for iPhone</a>",Retweet,,,1,0,0
1103842427230670848,@jamesjbrownjr james,Travis,ZebraDontCare,Fri Mar 08 02:18:37 +0000 2019,2,0,English,"<a href=""http://twitter.com/download/iphone"" rel=""nofollow"">Twitter for iPhone</a>",Reply,,,0,0,1
1104043950892072962,"@nirysi See also the number of viral videos, especially early ones, that hinge on this kind of thing.

Half the videos on ebaumsworld in the early 00s( I know, but it really was the original viral video site) hinge on laughing at people of color.",Travis,ZebraDontCare,Fri Mar 08 15:39:24 +0000 2019,0,0,English,"<a href=""http://twitter.com/download/iphone"" rel=""nofollow"">Twitter for iPhone</a>",Reply,,,0,0,1
1104044773617426432,"@nirysi Examples: Leprechaun in Alabama, Bubb Rubb, the “milkshake” video. All hosted on ebaums in the early 00s, all examples of early viral videos.

The origins of viral videos on the web carry a lot of racist (and if you expand the net a bit, classist) baggage.",Travis,ZebraDontCare,Fri Mar 08 15:42:40 +0000 2019,0,0,English,"<a href=""http://twitter.com/download/iphone"" rel=""nofollow"">Twitter for iPhone</a>",Reply,,,0,0,1
1104045343040327682,"@nirysi And, if you look at web access at the time by demographic, the situation becomes even more damning since physical access at the time was not widely distributed among all social and racial groups: you needed a laptop.

(accidental thread, sorry)",Travis,ZebraDontCare,Fri Mar 08 15:44:56 +0000 2019,0,0,English,"<a href=""http://twitter.com/download/iphone"" rel=""nofollow"">Twitter for iPhone</a>",Reply,,,0,0,1
1104052216225255425,"This is more complicated than it seems on the surface, but the lawsuit is more than justified. https://t.co/xmXefUBMxD",Travis,ZebraDontCare,Fri Mar 08 16:12:15 +0000 2019,0,0,English,"<a href=""http://twitter.com"" rel=""nofollow"">Twitter Web Client</a>",Tweet,,,1,0,0
1104086745665232899,Presented without comment or context. https://t.co/3QcUH7I3Ic,Travis,ZebraDontCare,Fri Mar 08 18:29:27 +0000 2019,4,0,English,"<a href=""http://twitter.com"" rel=""nofollow"">Twitter Web Client</a>",Tweet,Photo,https://pbs.twimg.com/media/D1KA6W2W0AAYDRL.png ,0,0,0
1104133549811216384,The @ruaaup is taking a strike authorization vote. We are fighting for quality public education.  https://t.co/LC00KOjeny,Travis,ZebraDontCare,Fri Mar 08 21:35:26 +0000 2019,0,1,English,"<a href=""http://twitter.com/download/iphone"" rel=""nofollow"">Twitter for iPhone</a>",Retweet,,,1,0,1
1104404115348688896,Clearly. https://t.co/VEdpe68n0V,Travis,ZebraDontCare,Sat Mar 09 15:30:34 +0000 2019,3,0,English,"<a href=""http://twitter.com/download/iphone"" rel=""nofollow"">Twitter for iPhone</a>",Tweet,Photo,https://pbs.twimg.com/media/D1OhrwIWkAAlgKb.jpg ,0,0,0
1104418453555986432,"Christian Pulisic just scored a goal for Dortmund vs. Stuttgart. Video:
https://t.co/kqQhKrMV18",Travis,ZebraDontCare,Sat Mar 09 16:27:33 +0000 2019,0,2,English,"<a href=""http://twitter.com/download/iphone"" rel=""nofollow"">Twitter for iPhone</a>",Retweet,,,1,0,0
1104491155809619968,Be sure to plant early. https://t.co/FzfMBa6wiJ,Travis,ZebraDontCare,Sat Mar 09 21:16:26 +0000 2019,1,0,English,"<a href=""http://twitter.com/download/iphone"" rel=""nofollow"">Twitter for iPhone</a>",Tweet,Photo,https://pbs.twimg.com/media/D1Pw2X9WsAIFjs-.jpg ,0,0,0
1104495563792355329,Unsaid: Adidas paid unequal World Cup bonuses until today. Guessing a lot of companies do. https://t.co/0EdAsQDICs,Travis,ZebraDontCare,Sat Mar 09 21:33:57 +0000 2019,0,73,English,"<a href=""http://twitter.com/download/iphone"" rel=""nofollow"">Twitter for iPhone</a>",Retweet,Photo,https://pbs.twimg.com/media/D1LPA4PW0AAKON0.jpg ,0,0,0
1104915400024879105,"If I'm sure of anything after today, it's that Atlanta will figure out whatever ails them next Sunday night when the Union visit...",Travis,ZebraDontCare,Mon Mar 11 01:22:14 +0000 2019,0,2,English,"<a href=""http://twitter.com"" rel=""nofollow"">Twitter Web Client</a>",Retweet,,,0,0,0
1105424664719958017,Anyone who turns an overhead light on before 8a is a serial killer.,Travis,ZebraDontCare,Tue Mar 12 11:05:52 +0000 2019,0,0,English,"<a href=""http://twitter.com"" rel=""nofollow"">Twitter Web Client</a>",Tweet,,,0,0,0
1105459221989076993,"Mark Twain didn’t learn to read until he was 63
Stanley Kubrick was only 41 when he faked the moon landing
Paul McCartney was already dead when The Beatles recorded Abbey Road

It’s never too late. Don’t give up",Travis,ZebraDontCare,Tue Mar 12 13:23:11 +0000 2019,0,13026,English,"<a href=""http://twitter.com/download/iphone"" rel=""nofollow"">Twitter for iPhone</a>",Retweet,,,0,0,0
1105481497660874752,huh https://t.co/Axq97aFD9w,Travis,ZebraDontCare,Tue Mar 12 14:51:42 +0000 2019,0,0,Undetermined,"<a href=""http://twitter.com/download/iphone"" rel=""nofollow"">Twitter for iPhone</a>",Tweet,,,1,0,0
1105486545925095424,Parenting is like driving down the highway in first gear.,Travis,ZebraDontCare,Tue Mar 12 15:11:46 +0000 2019,1,0,English,"<a href=""http://twitter.com/download/iphone"" rel=""nofollow"">Twitter for iPhone</a>",Tweet,,,0,0,0
1105496453689065472,@nirysi I allow it. I also sometimes offer music when there’s some kind of workshop time. Although I guess I’m also a millennial so 🤷‍♂️,Travis,ZebraDontCare,Tue Mar 12 15:51:08 +0000 2019,2,0,English,"<a href=""http://twitter.com/download/iphone"" rel=""nofollow"">Twitter for iPhone</a>",Reply,,,0,0,1
1105523603586592768,Long awaited Britney Spears musical will finally debut and the plot sounds absolutely BONKERS https://t.co/Kd5Qsxdu9j https://t.co/Ugu5bQ99gD,Travis,ZebraDontCare,Tue Mar 12 17:39:01 +0000 2019,0,540,English,"<a href=""http://twitter.com"" rel=""nofollow"">Twitter Web Client</a>",Retweet,Photo,https://pbs.twimg.com/media/D1dxkbmXQAANQnA.jpg ,1,0,0
1105538792415526913,today; we are all Yale,Travis,ZebraDontCare,Tue Mar 12 18:39:22 +0000 2019,0,3798,English,"<a href=""http://twitter.com/download/iphone"" rel=""nofollow"">Twitter for iPhone</a>",Retweet,,,0,0,0
1105539098650075138,"Drunk Hulk not being verified is one of the great Twitter tragedies. He broke Gaddafi’s death first, he earned it. https://t.co/44iR0qWwsN",Travis,ZebraDontCare,Tue Mar 12 18:40:35 +0000 2019,0,0,English,"<a href=""http://twitter.com/download/iphone"" rel=""nofollow"">Twitter for iPhone</a>",Tweet,,,1,0,0
1105544014516883457,@MnNiceFC Was it @AlexBurdine ? That sounds like him.,Travis,ZebraDontCare,Tue Mar 12 19:00:07 +0000 2019,0,0,English,"<a href=""http://twitter.com"" rel=""nofollow"">Twitter Web Client</a>",Reply,,,0,0,1
1105546394763431938,I know her! https://t.co/pilMQaVsXQ,Travis,ZebraDontCare,Tue Mar 12 19:09:35 +0000 2019,2,0,English,"<a href=""http://twitter.com/download/iphone"" rel=""nofollow"">Twitter for iPhone</a>",Tweet,,,1,0,0
1105551891289858051,@nirysi This is academia. There is A Debate.,Travis,ZebraDontCare,Tue Mar 12 19:31:25 +0000 2019,1,0,English,"<a href=""http://twitter.com/download/iphone"" rel=""nofollow"">Twitter for iPhone</a>",Reply,,,0,0,1
1105554663263387648,It's almost like everything that happened in 2016 was ill-considered and we should consider it a mulligan year. https://t.co/2G0weX89oj,Travis,ZebraDontCare,Tue Mar 12 19:42:26 +0000 2019,0,0,English,"<a href=""http://twitter.com"" rel=""nofollow"">Twitter Web Client</a>",Tweet,,,1,0,0
1105557706516168704,if harvard offered to increase my IQ by one point per dollar i would simply say no. And that's the most important takeaway from all this,Travis,ZebraDontCare,Tue Mar 12 19:54:32 +0000 2019,0,3322,English,"<a href=""http://twitter.com"" rel=""nofollow"">Twitter Web Client</a>",Retweet,,,0,0,0
1105559935331590154,"https://t.co/nCx5LcgXhy

Like most 90’s kids, I grew up watching Fresh Prince. Even as a kid, I always thought there was more to the story... so I decided to make this. S/O to incredible team who worked on this! @tldtoday @kustoo @BeleafMel @easymccoy @madebyutah @txyxuxs",Travis,ZebraDontCare,Tue Mar 12 20:03:23 +0000 2019,0,6720,English,"<a href=""http://twitter.com"" rel=""nofollow"">Twitter Web Client</a>",Retweet,,,1,0,6
1105591479723003905,The eons-long runtimes of kids’ YouTube videos tells you more about the experience of parenting than any parenting book.,Travis,ZebraDontCare,Tue Mar 12 22:08:44 +0000 2019,0,0,English,"<a href=""http://twitter.com/download/iphone"" rel=""nofollow"">Twitter for iPhone</a>",Tweet,,,0,0,0
1105806007446499328,"Me: Today at school you’re going to get eggs which will hatch into baby chicks!

2YO: I want to eat the baby chicks.",Travis,ZebraDontCare,Wed Mar 13 12:21:11 +0000 2019,6,0,English,"<a href=""http://twitter.com/download/iphone"" rel=""nofollow"">Twitter for iPhone</a>",Tweet,,,0,0,0
1105862028474884097,"🌟DWARF FORTRESS🌟

The deepest, most intricate simulation of a world. A legendary game with all new graphics/audio.

Wishlist: https://t.co/08KDWA24XX
@itchio: https://t.co/fCLxjG825i
Discord: https://t.co/ccg13R8YRo

Developed by: @Bay12Games | Publisher: @KitfoxGames https://t.co/5Doxq3XzKg",Travis,ZebraDontCare,Wed Mar 13 16:03:48 +0000 2019,0,2392,English,"<a href=""http://twitter.com"" rel=""nofollow"">Twitter Web Client</a>",Retweet,Video,https://video.twimg.com/amplify_video/1105838051174084608/vid/640x360/c084I3oq5MN-iecU.mp4?tag=11 ,3,0,3
1105991063741874177,#ATLvMTY is probably the most enjoyable CONCACAF match I’ve ever watched. #ccl,Travis,ZebraDontCare,Thu Mar 14 00:36:32 +0000 2019,0,0,English,"<a href=""http://twitter.com/download/iphone"" rel=""nofollow"">Twitter for iPhone</a>",Tweet,,,0,2,0
1105995984545501185,@bdgwrn True story: I’ve seen job ads that ask for more years of experience in a programming language than that language has existed.,Travis,ZebraDontCare,Thu Mar 14 00:56:05 +0000 2019,2,0,English,"<a href=""http://twitter.com/download/iphone"" rel=""nofollow"">Twitter for iPhone</a>",Reply,,,0,0,1
1106298829584957440,"When you read about Lori Loughlin and Felicity Huffman, remember Tonya McDowell, a Black mom from Connecticut who spent 2012-2017 in jail for lying about her address to send her kindergartener to a better school. The whole damn system is guilty. 

#CollegeCheatingScandal https://t.co/Ns1J2X90Ox",Travis,ZebraDontCare,Thu Mar 14 20:59:29 +0000 2019,0,10814,English,"<a href=""http://twitter.com/download/iphone"" rel=""nofollow"">Twitter for iPhone</a>",Retweet,Photo,https://pbs.twimg.com/media/D1kuLtdWsAExmK1.jpg ,0,1,0
1106330473582788609,"Spent the better part of the day trying to remember if I’ve ever read Portrait of a Lady.

Still don’t know.",Travis,ZebraDontCare,Thu Mar 14 23:05:14 +0000 2019,0,0,English,"<a href=""http://twitter.com/download/iphone"" rel=""nofollow"">Twitter for iPhone</a>",Tweet,,,0,0,0
1106352731512553472,Beto's campaign is off to a rough start https://t.co/b3BOkiQWuA,Travis,ZebraDontCare,Fri Mar 15 00:33:40 +0000 2019,0,300,English,"<a href=""http://twitter.com/download/iphone"" rel=""nofollow"">Twitter for iPhone</a>",Retweet,Photo,https://pbs.twimg.com/media/D1o-v0AWkAURmjo.png https://pbs.twimg.com/media/D1o-7TlWkAUvupk.jpg ,0,0,0
1106557438914949122,"Me: I’m not going to drink the full pot of stovetop espresso this time.

Me, after drinking the full pot of stovetop espresso: https://t.co/PtZbak6kef",Travis,ZebraDontCare,Fri Mar 15 14:07:06 +0000 2019,1,0,English,"<a href=""http://twitter.com/download/iphone"" rel=""nofollow"">Twitter for iPhone</a>",Tweet,GIF,https://video.twimg.com/tweet_video/D1tIH0uXQAAQY53.mp4 ,0,0,0
1106568093638238208,"1. The linked article by @ebruenig is characteristically thoughtful, and should provoke a conversation about how Nazism and trolling aren't mutually exclusive. In fact Nazism has always had a large element of half-joking. https://t.co/6WSEKfDMvu",Travis,ZebraDontCare,Fri Mar 15 14:49:27 +0000 2019,0,646,English,"<a href=""http://twitter.com/download/iphone"" rel=""nofollow"">Twitter for iPhone</a>",Retweet,,,1,0,1
1106681681824624640,"Beto was in CDC?!

We are truly in the strangest timeline. Also if this is true, wtf happened to his politics? https://t.co/U8NibrRJj0",Travis,ZebraDontCare,Fri Mar 15 22:20:48 +0000 2019,2,0,English,"<a href=""http://twitter.com/download/iphone"" rel=""nofollow"">Twitter for iPhone</a>",Tweet,,,1,0,0
1106682929772662789,Also obligatory re Cult of the Dead Cow: https://t.co/jtlNPIAtxX,Travis,ZebraDontCare,Fri Mar 15 22:25:46 +0000 2019,2,0,English,"<a href=""http://twitter.com/download/iphone"" rel=""nofollow"">Twitter for iPhone</a>",Reply,GIF,https://video.twimg.com/tweet_video/D1u6QXPWoAQsVXK.mp4 ,0,0,0
1106712610827833344,West Philly dirt bike sighting. https://t.co/rmXVNT542j,Travis,ZebraDontCare,Sat Mar 16 00:23:42 +0000 2019,1,0,English,"<a href=""http://twitter.com/download/iphone"" rel=""nofollow"">Twitter for iPhone</a>",Tweet,Photo,https://pbs.twimg.com/media/D1vVQIbXcAA52F6.jpg ,0,0,0
1106736482360983552,This is made of sugar and it’s two years old. https://t.co/XAwzj7M5RH,Travis,ZebraDontCare,Sat Mar 16 01:58:34 +0000 2019,2,0,English,"<a href=""http://twitter.com/download/iphone"" rel=""nofollow"">Twitter for iPhone</a>",Tweet,Photo,https://pbs.twimg.com/media/D1vq8wlW0AAEt-e.jpg ,0,0,0
1106929641988726785,"Egg kid gets the senate seat, he is the senator now.",Travis,ZebraDontCare,Sat Mar 16 14:46:07 +0000 2019,1,0,English,"<a href=""http://twitter.com/download/iphone"" rel=""nofollow"">Twitter for iPhone</a>",Tweet,,,0,0,0
1106961502387560449,"I just learned that Google is already doing this for ISIS-related content, but has not applied the same approach to white supremacist terrorism. 🤔 https://t.co/Mip9b2KdiQ",Travis,ZebraDontCare,Sat Mar 16 16:52:43 +0000 2019,0,1302,English,"<a href=""http://twitter.com/download/iphone"" rel=""nofollow"">Twitter for iPhone</a>",Retweet,,,1,0,0
1107073267909775362,guy who threw shoe at bush walked so egg boy could run,Travis,ZebraDontCare,Sun Mar 17 00:16:50 +0000 2019,0,22575,English,"<a href=""http://twitter.com/download/iphone"" rel=""nofollow"">Twitter for iPhone</a>",Retweet,,,0,0,0
1107437342367928322,"Debut goal from an 18 year old at distance in front of 70k in Atlanta. Unbelievable.

#ATLvPHI",Travis,ZebraDontCare,Mon Mar 18 00:23:32 +0000 2019,1,0,English,"<a href=""http://twitter.com"" rel=""nofollow"">Twitter Web Client</a>",Tweet,,,0,1,0
1107437494361092096,Forgot: #DOOP https://t.co/qpPU3dNJiq,Travis,ZebraDontCare,Mon Mar 18 00:24:08 +0000 2019,0,0,English,"<a href=""http://twitter.com"" rel=""nofollow"">Twitter Web Client</a>",Tweet,,,1,1,0
1107437529668694016,"47' AND THE KID @AaronsonBrenden SCORES HIS FIRST GOAL IN HIS FIRST GAME!

EVERYTHING I WANT TO TYPE IS NOT APPROPRIATE RIGHT NOOOOOW

#DOOP | #ThisIsPhilly https://t.co/7yVxOajg86",Travis,ZebraDontCare,Mon Mar 18 00:24:16 +0000 2019,0,153,English,"<a href=""http://twitter.com"" rel=""nofollow"">Twitter Web Client</a>",Retweet,Video,https://video.twimg.com/amplify_video/1101898472964411392/vid/320x180/R6_b_u42RNXHCsVc.mp4?tag=9 ,0,2,1
1107439081804496896,"Jack Elliott is making a strong argument for the starting nod vs Columbus next week.

#ATLvPHI",Travis,ZebraDontCare,Mon Mar 18 00:30:26 +0000 2019,0,0,English,"<a href=""http://twitter.com"" rel=""nofollow"">Twitter Web Client</a>",Tweet,,,0,1,0
1107445278490193921,@BrotherlyGame Burke is not making an argument for a starting slot.,Travis,ZebraDontCare,Mon Mar 18 00:55:04 +0000 2019,1,0,English,"<a href=""http://twitter.com"" rel=""nofollow"">Twitter Web Client</a>",Reply,,,0,0,1
1107447170377138176,"Whenever the Union have the ball on the wing in the final third they look trapped rather than dangerous.

#ATLvPHI",Travis,ZebraDontCare,Mon Mar 18 01:02:35 +0000 2019,0,0,English,"<a href=""http://twitter.com"" rel=""nofollow"">Twitter Web Client</a>",Tweet,,,0,1,0
1107449612590350338,Leaving Atlanta with a point is no joke given the Union's starting woes. Kai Wagner continues to impress and Jones had some decent tackles. Burke is not looking like a starting striker.,Travis,ZebraDontCare,Mon Mar 18 01:12:17 +0000 2019,25,1,English,"<a href=""http://twitter.com"" rel=""nofollow"">Twitter Web Client</a>",Tweet,,,0,0,0
1107449745000275969,HEY @DeBoerMustGo YOU OKAY WITH 1 POINT? U GUYS ARE MLS CHAMPS AND ONE TIME @PhilaUnion HAD RICHIE MARQUEZ NIGHT. AND SPELLED RICHIE MARQUEZ NAME WRONG.,Travis,ZebraDontCare,Mon Mar 18 01:12:49 +0000 2019,0,5,English,"<a href=""http://twitter.com"" rel=""nofollow"">Twitter Web Client</a>",Retweet,,,0,0,2
1107453437724237825,@Gibsonkid1 I honestly think the issue with Haris is that Curtin doesn't want to have to tell him he's not in the XI.,Travis,ZebraDontCare,Mon Mar 18 01:27:29 +0000 2019,2,0,English,"<a href=""http://twitter.com"" rel=""nofollow"">Twitter Web Client</a>",Reply,,,0,0,1
1107727144036298752,"This next song is called, ""If the Project is Building, Don't Update Your Tools"", and it goes like this: https://t.co/bf3P2xP115",Travis,ZebraDontCare,Mon Mar 18 19:35:06 +0000 2019,2,0,English,"<a href=""http://twitter.com"" rel=""nofollow"">Twitter Web Client</a>",Tweet,GIF,https://video.twimg.com/tweet_video/D19v8zSWsAAMmlj.mp4 ,0,0,0
1107732892136935426,"I always teach my students to use descriptive commit messages, gotta model good behavior. https://t.co/ZajWCojU7S",Travis,ZebraDontCare,Mon Mar 18 19:57:56 +0000 2019,2,0,English,"<a href=""http://twitter.com"" rel=""nofollow"">Twitter Web Client</a>",Tweet,Photo,https://pbs.twimg.com/media/D191MCkX4AEhTPH.png ,0,0,0
1107762930714636293,Just remembered that kids' show Wishbone where a dog reenacted scenes from literature and the episode on The Odyssey where a teenage boy had to spend half an hour calling the dog his dad.,Travis,ZebraDontCare,Mon Mar 18 21:57:18 +0000 2019,1,0,English,"<a href=""http://twitter.com"" rel=""nofollow"">Twitter Web Client</a>",Tweet,,,0,0,0
1107802399815671808,"Of course, this process can also backfire spectacularly: I can attempt to perfect minor things as a means to avoid confronting the substance of the project at all. I once lost a week teaching myself to write grammar files for Atom just to get syntax highlighting in my editor.",Travis,ZebraDontCare,Tue Mar 19 00:34:08 +0000 2019,0,0,English,"<a href=""http://twitter.com"" rel=""nofollow"">Twitter Web Client</a>",Reply,,,0,0,0
1107802399048167424,"But, while I'm doing these minor things, the substance of the piece is still there, and after a few hours tinkering I usually find myself annoyed enough by the big problems to confront them.",Travis,ZebraDontCare,Tue Mar 19 00:34:08 +0000 2019,0,0,English,"<a href=""http://twitter.com"" rel=""nofollow"">Twitter Web Client</a>",Reply,,,0,0,0
1107802398389661697,"With writing, there's nothing else to do but put down words. But with a coding project I can find something minor to futz with.

Today, for example, I did nothing but work on a build process and remove weird markup artifacts from a previous version of the project.",Travis,ZebraDontCare,Tue Mar 19 00:34:08 +0000 2019,0,0,English,"<a href=""http://twitter.com"" rel=""nofollow"">Twitter Web Client</a>",Reply,,,0,0,0
1107802397781442560,One thing about creative coding is having the ability to tinker with something rather than working on its substance. I can be productive without confronting the intimidating conceptual pieces preventing me from starting.,Travis,ZebraDontCare,Tue Mar 19 00:34:08 +0000 2019,0,0,English,"<a href=""http://twitter.com"" rel=""nofollow"">Twitter Web Client</a>",Tweet,,,0,0,0
1107956819669012480,"Nancy by Olivia Jaimes for March 19, 2019  https://t.co/NlSA91WHZA https://t.co/hsCNLb1Rqq",Travis,ZebraDontCare,Tue Mar 19 10:47:45 +0000 2019,0,123,English,"<a href=""http://twitter.com/download/iphone"" rel=""nofollow"">Twitter for iPhone</a>",Retweet,Photo,https://pbs.twimg.com/media/D2AHvTxWwAEfugy.jpg ,1,0,0
1107968315148906496,RIP the ratios of all the sportswriters announcing Adams will play RB in this #USMNT camp.,Travis,ZebraDontCare,Tue Mar 19 11:33:26 +0000 2019,0,1,English,"<a href=""http://twitter.com/download/iphone"" rel=""nofollow"">Twitter for iPhone</a>",Tweet,,,0,1,0
1107996586662154240,@Jillio Leaving the Atocha Station? Lydia Davis or Amy Hempel collected stories? How Should a Person Be?,Travis,ZebraDontCare,Tue Mar 19 13:25:46 +0000 2019,1,0,English,"<a href=""http://twitter.com/download/iphone"" rel=""nofollow"">Twitter for iPhone</a>",Reply,,,0,0,1
1108008338040729602,What a ratio. https://t.co/M4mXcbm1tO,Travis,ZebraDontCare,Tue Mar 19 14:12:28 +0000 2019,0,0,English,"<a href=""http://twitter.com/download/iphone"" rel=""nofollow"">Twitter for iPhone</a>",Tweet,,,1,0,0
1108029112654929920,@ChappellTracker where did you find this,Travis,ZebraDontCare,Tue Mar 19 15:35:01 +0000 2019,0,0,English,"<a href=""http://twitter.com"" rel=""nofollow"">Twitter Web Client</a>",Reply,,,0,0,1
1108037734747258881,This contains a lot of funny stuff. But what it actually is is a politician attempting to abuse the judicial process in order to scare people out of criticizing him by proving that he can cost them a lot in legal fees. https://t.co/kRUutGrJQl,Travis,ZebraDontCare,Tue Mar 19 16:09:16 +0000 2019,0,3647,English,"<a href=""http://twitter.com/download/iphone"" rel=""nofollow"">Twitter for iPhone</a>",Retweet,,,1,0,0
1108042268878036992,"Found the clip in question, it's more beautiful than I remember: https://t.co/SwqboT0EOT https://t.co/FtbmgjwMoC",Travis,ZebraDontCare,Tue Mar 19 16:27:17 +0000 2019,2,0,English,"<a href=""http://twitter.com"" rel=""nofollow"">Twitter Web Client</a>",Tweet,,,2,0,0
1108051573442269184,@joshmorrissey make it stop,Travis,ZebraDontCare,Tue Mar 19 17:04:16 +0000 2019,1,0,English,"<a href=""http://twitter.com/download/iphone"" rel=""nofollow"">Twitter for iPhone</a>",Reply,,,0,0,1
1108061238469251080,Phantom Thread (2017) https://t.co/bTAKavqKb9,Travis,ZebraDontCare,Tue Mar 19 17:42:40 +0000 2019,0,64,English,"<a href=""http://twitter.com"" rel=""nofollow"">Twitter Web Client</a>",Retweet,Photo,https://pbs.twimg.com/media/DakLn_aWAAEU3_9.jpg ,0,0,0
1108064028931342337,"This is just to say

I have spent
the tax refund
that came in
the mail

and which
you were probably
saving
for groceries

Forgive me
this pizza oven was
so small
and so hot https://t.co/87Q76lRdsq",Travis,ZebraDontCare,Tue Mar 19 17:53:45 +0000 2019,2,2,English,"<a href=""http://twitter.com"" rel=""nofollow"">Twitter Web Client</a>",Tweet,,,1,0,0
1108162219353825281,@achewood are you there? https://t.co/vI0560bICg,Travis,ZebraDontCare,Wed Mar 20 00:23:56 +0000 2019,0,0,English,"<a href=""http://twitter.com"" rel=""nofollow"">Twitter Web Client</a>",Tweet,,,1,0,1
1108370855321587712,"In the Mood for Love (2001)

All those beautiful shots of Maggie Cheung walking and Robocop in the background staring into the middle distance. https://t.co/7xs0m5MZyq",Travis,ZebraDontCare,Wed Mar 20 14:12:59 +0000 2019,0,0,English,"<a href=""http://twitter.com"" rel=""nofollow"">Twitter Web Client</a>",Tweet,,,1,0,0
1108859028464197633,Powerline from A Goofy Movie definitely got caught in some gross scandal eventually send tweet,Travis,ZebraDontCare,Thu Mar 21 22:32:48 +0000 2019,2,0,English,"<a href=""http://twitter.com/download/iphone"" rel=""nofollow"">Twitter for iPhone</a>",Tweet,,,0,0,0
1109074779926085634,@Annalocky Server: No? This is a MENU. Those words are FOODS YOU CAN EAT.,Travis,ZebraDontCare,Fri Mar 22 12:50:07 +0000 2019,1,0,English,"<a href=""http://twitter.com/download/iphone"" rel=""nofollow"">Twitter for iPhone</a>",Reply,,,0,0,1
1109972830731554817,"@HeerJeet Did you read that Finnegan's Wake/Ulysses campaign comparison he did or was that, as I suspected, parody?",Travis,ZebraDontCare,Mon Mar 25 00:18:39 +0000 2019,0,0,English,"<a href=""http://twitter.com"" rel=""nofollow"">Twitter Web Client</a>",Reply,,,0,0,1
1110340777723547649,It's impossible for me not to laugh out loud at a David Brooks headline. Each one is further beyond self-parody than the last.,Travis,ZebraDontCare,Tue Mar 26 00:40:45 +0000 2019,0,0,English,"<a href=""http://twitter.com"" rel=""nofollow"">Twitter Web Client</a>",Tweet,,,0,0,0
1110548535815127040,"Sure, YouTube's algorithm promotes far-right hate speech and conspiracy theories, but have you heard LOFI HIP HOP BEATS TO STUDY/RELAX/SMOKE TO?",Travis,ZebraDontCare,Tue Mar 26 14:26:18 +0000 2019,3,0,English,"<a href=""http://twitter.com"" rel=""nofollow"">Twitter Web Client</a>",Tweet,,,0,0,0
